{
  "review_id": "rework-verify-final-20261023-v2",
  "round": 0,
  "agent": "codex-agent",
  "artifact_sha256": "088ad8b5560c8e97a9280c39710d2d8183f8d003b2644483c534522bd4c29de9",
  "verdict": "APPROVE",
  "score": {
    "overall": 8.2,
    "criteria": {
      "correctness": 8.2,
      "completeness": 8.1,
      "risk": 8.5,
      "evidence": 7.4,
      "actionability": 9
    }
  },
  "findings": [
    {
      "id": "R0-META-001",
      "severity": "MINOR",
      "claim": "Some machine-readable execution metadata does not directly encode the final stated outcome, although the accompanying notes disclose the discrepancy.",
      "evidence": "V_RW_COMPLETION_REQUIRED is status PASS with exit 1; its note says the initial run failed and a post-regeneration run passed 12/12. V_RW_REAL_COMET_RECOVERY and V_POST_DELIVERY_PERMISSIONS are PASS with null exit and seconds, while their journey records provide passing recipe counts and detailed evidence paths.",
      "recommendation": "Represent multiple attempts explicitly and record the final attempt's exit code and duration; preserve earlier failures in a separate attempts/history field.",
      "blocking": false
    },
    {
      "id": "R0-SCOPE-002",
      "severity": "NOTE",
      "claim": "Approval is valid only for completion of the VERIFY run and delivery of its evidence, not for overall goal completion or full production enablement.",
      "evidence": "The artifact sets goal_complete=false and lists unresolved holders for F10 cross-machine enablement, real-container S6/S7/S8, the knowledge-DB backup channel, live alert delivery, unauthenticated web-channel ACL, F01/F03 assertion mapping, runner probe naming, and GitHub readback. P1-05 also explicitly carries its real-container half as staged-UNVERIFIED.",
      "recommendation": "Keep the overall goal open and retain every named holder until the corresponding capability is independently exercised; do not present this approval as production-readiness approval.",
      "blocking": false
    },
    {
      "id": "R0-PROVENANCE-003",
      "severity": "MINOR",
      "claim": "The relationship between the tested source baseline and the report-packaging revision should be made explicit.",
      "evidence": "The artifact records baseline.source_head as 6918798, while the review scope identifies the three-artifact report at git 0dcfec1; the JSON does not provide a field binding those two revisions or hashes for the companion Markdown artifacts.",
      "recommendation": "Add tested_source_commit, report_commit, and companion-artifact digests to the machine-readable report.",
      "blocking": false
    }
  ],
  "assumptions": [
    "Git 0dcfec1 is the report-packaging revision and 6918798 is the source revision actually exercised; they are not competing claims about one baseline.",
    "The supplied artifact digest identifies the reviewed JSON bytes.",
    "The gated decision is narrowly scoped to accepting the VERIFY node and the completed verification run, consistent with goal_complete=false."
  ],
  "confidence": 0.84,
  "summary": "APPROVE the scoped VERIFY-node and run-completion decision. The artifact classifies all 118 required checks (104 PASS, 9 known environment drift, 3 UNVERIFIED, 2 FAIL), supplies detailed evidence for three real journeys, binds all seven P1 workstreams to fixes and readbacks, and honestly preserves failures, unverified capabilities, holders, and goal_complete=false. Minor metadata and provenance weaknesses should be corrected in the reporting format but do not negate the explicitly limited decision."
}